{
  "$schema": "https://json-schema.org/draft/2020-12/schema",
  "$id": "nextgen://recipes/recipe-instance.schema.json",
  "type": "object",
  "required": ["recipeRef", "presetId", "params", "fingerOverrides"],
  "properties": {
    "recipeRef": {"type": "object", "required": ["id", "version"], "properties": {"id": {"const": "mercury-dew"}, "version": {"pattern": "^[0-9]+\\.[0-9]+\\.[0-9]+$"}}},
    "presetId": {"enum": ["subtle", "signature", "statement"]},
    "params": {"type": "object", "required": ["baseColor", "baseCoverage", "opticalEffect", "topFinish", "catEyeAngleDeg", "beamWidth", "beamIntensity", "ribbonMaterial", "ribbonWidthMm", "ribbonHeightMm", "ribbonAnchors", "dropletDensity", "dropletSizeMm", "droplets"], "properties": {
      "baseColor": {"type": "string", "pattern": "^#[0-9A-Fa-f]{6}$"},
      "baseCoverage": {"enum": ["opaque", "translucent"]},
      "opticalEffect": {"const": "cat-eye"},
      "topFinish": {"const": "gloss"},
      "catEyeAngleDeg": {"type": "number", "minimum": -90, "maximum": 90},
      "beamWidth": {"enum": ["narrow", "standard", "wide"]},
      "beamIntensity": {"enum": ["soft", "standard", "strong"]},
      "ribbonMaterial": {"enum": ["silver", "champagne"]},
      "ribbonWidthMm": {"enum": [0.35, 0.5, 0.7]},
      "ribbonHeightMm": {"enum": [0.12, 0.18, 0.24]},
      "ribbonAnchors": {"type": "array", "minItems": 3, "maxItems": 3, "items": {"$ref": "nextgen://recipes/uv.schema.json"}},
      "dropletDensity": {"enum": ["off", "subtle", "standard"]},
      "dropletSizeMm": {"enum": [0.8, 1.2, 1.8]},
      "droplets": {"type": "array", "maxItems": 6, "items": {"type": "object", "required": ["id", "uv", "radiusMm", "heightMm"], "properties": {"id": {"type": "string"}, "uv": {"$ref": "nextgen://recipes/uv.schema.json"}, "radiusMm": {"type": "number", "minimum": 0.1}, "heightMm": {"type": "number", "minimum": 0.05, "maximum": 0.3}}}}
    }},
    "fingerOverrides": {"type": "object", "additionalProperties": {"type": "object", "properties": {"enabled": {"type": "boolean"}, "params": {"type": "object"}}}}
  }
}
